{
  "audit_level": "medium",
  "risk_paths": ["src/server/", "infra/", "db/"],
  "gate": {
    "require_plan_for_risk_paths": true,
    "require_audit_before_write": true
  },
  "tests": {
    "on_change": "smoke",
    "on_risk_change": "unit",
    "commands": {
      "smoke": "npm test --silent",
      "unit": "npm test",
      "full": "npm test"
    }
  },
  "permissions": {
    "deny_skip_tests": true,
    "deny_unsafe_db_ops": true
  }
}
